{
  "$schema": "https://json-schema.org/draft/2020-12/schema",
  "$id": "doi-method/scorecard.json",
  "title": "DOI Engagement Scorecard",
  "type": "object",
  "required": ["organization", "generated_at", "verdict", "ratings", "deployable", "remediation"],
  "properties": {
    "organization": { "type": "string" },
    "primary_goal": { "type": "string" },
    "generated_at": { "type": "string", "format": "date" },
    "verdict": {
      "type": "object",
      "required": ["ready_status", "summary_line", "constraint_line"],
      "properties": {
        "ready_status": { "enum": ["YES", "NO", "CONDITIONAL"] },
        "summary_line": { "type": "string", "description": "Deployment count, cost envelope, FTE commitment" },
        "constraint_line": { "type": "string", "description": "Single largest constraint identified" }
      }
    },
    "ratings": {
      "type": "object",
      "required": ["talent_strategy", "workflow_optimization", "digital_architecture"],
      "properties": {
        "talent_strategy": { "$ref": "#/$defs/rating" },
        "workflow_optimization": { "$ref": "#/$defs/rating" },
        "digital_architecture": { "$ref": "#/$defs/rating" },
        "knowledge_management": { "$ref": "#/$defs/rating" },
        "ai_automation": { "$ref": "#/$defs/rating" }
      }
    },
    "deployable": {
      "type": "array",
      "description": "Tier 1 + Tier 2 interventions",
      "items": {
        "type": "object",
        "required": ["slug", "name", "tier", "value_line", "quarter"],
        "properties": {
          "slug": { "type": "string" },
          "name": { "type": "string" },
          "tier": { "enum": [1, 2] },
          "value_line": { "type": "string", "description": "One-line value thesis" },
          "quarter": { "type": "string", "pattern": "^Q[1-4]$" },
          "human_effort": { "type": "string", "description": "e.g. '2 weeks'" },
          "doi_effort": { "type": "string", "description": "e.g. '1 hour'" }
        }
      }
    },
    "remediation": {
      "type": "object",
      "description": "One-sentence-per-quarter remediation roadmap headlines",
      "required": ["q1", "q2", "q3"],
      "properties": {
        "q1": { "type": "string" },
        "q2": { "type": "string" },
        "q3": { "type": "string" }
      }
    }
  },
  "$defs": {
    "rating": {
      "type": "object",
      "required": ["score", "rating_text", "justification"],
      "properties": {
        "score": { "type": "integer", "minimum": 0, "maximum": 15, "description": "Pillar 0-15 score from Phase 8" },
        "rating_text": { "enum": ["Critical", "Weak", "Moderate", "Strong", "Mature"], "description": "Banded label: 0-3 Critical, 4-6 Weak, 7-9 Moderate, 10-12 Strong, 13-15 Mature" },
        "justification": { "type": "string", "maxLength": 200 }
      }
    }
  }
}
